"No.","Time","Source","Destination","Protocol","Length","Length","Info"
"3","0.000024","167.7.2.3","167.7.4.2","TCP","74","","49153  >  http-alt(8080) [SYN] Seq=0 Win=65535 Len=0 TSval=1000 TSecr=0 WS=4 SACK_PERM=1"
"7","0.018336","167.7.2.3","167.7.4.2","TCP","70","","49153  >  http-alt(8080) [ACK] Seq=1 Ack=1 Win=131072 Len=0 TSval=1019 TSecr=1006"
"8","0.018344","167.7.2.3","167.7.4.2","TCP","606","","49153  >  http-alt(8080) [ACK] Seq=1 Ack=1 Win=131072 Len=536 TSval=1019 TSecr=1006"
"9","0.018410","167.7.2.3","167.7.4.2","TCP","606","","49153  >  http-alt(8080) [ACK] Seq=537 Ack=1 Win=131072 Len=536 TSval=1019 TSecr=1006"
"10","0.018472","167.7.2.3","167.7.4.2","TCP","606","","49153  >  http-alt(8080) [ACK] Seq=1073 Ack=1 Win=131072 Len=536 TSval=1019 TSecr=1006"
"11","0.018527","167.7.2.3","167.7.4.2","TCP","606","","49153  >  http-alt(8080) [ACK] Seq=1609 Ack=1 Win=131072 Len=536 TSval=1019 TSecr=1006"
"12","0.018586","167.7.2.3","167.7.4.2","TCP","606","","49153  >  http-alt(8080) [ACK] Seq=2145 Ack=1 Win=131072 Len=536 TSval=1019 TSecr=1006"
"13","0.018642","167.7.2.3","167.7.4.2","TCP","606","","49153  >  http-alt(8080) [ACK] Seq=2681 Ack=1 Win=131072 Len=536 TSval=1019 TSecr=1006"
"14","0.018699","167.7.2.3","167.7.4.2","TCP","606","","49153  >  http-alt(8080) [ACK] Seq=3217 Ack=1 Win=131072 Len=536 TSval=1019 TSecr=1006"
"15","0.018757","167.7.2.3","167.7.4.2","TCP","606","","49153  >  http-alt(8080) [ACK] Seq=3753 Ack=1 Win=131072 Len=536 TSval=1019 TSecr=1006"
"16","0.018816","167.7.2.3","167.7.4.2","TCP","606","","49153  >  http-alt(8080) [ACK] Seq=4289 Ack=1 Win=131072 Len=536 TSval=1019 TSecr=1006"
"17","0.018875","167.7.2.3","167.7.4.2","TCP","606","","49153  >  http-alt(8080) [ACK] Seq=4825 Ack=1 Win=131072 Len=536 TSval=1019 TSecr=1006"
"19","0.029925","167.7.2.3","167.7.4.2","TCP","606","","49153  >  http-alt(8080) [ACK] Seq=5361 Ack=1 Win=131072 Len=536 TSval=1030 TSecr=1023"
"20","0.029976","167.7.2.3","167.7.4.2","TCP","606","","49153  >  http-alt(8080) [ACK] Seq=5897 Ack=1 Win=131072 Len=536 TSval=1030 TSecr=1023"
"22","0.030070","167.7.2.3","167.7.4.2","TCP","606","","49153  >  http-alt(8080) [ACK] Seq=6433 Ack=1 Win=131072 Len=536 TSval=1031 TSecr=1024"
"23","0.030120","167.7.2.3","167.7.4.2","TCP","606","","49153  >  http-alt(8080) [ACK] Seq=6969 Ack=1 Win=131072 Len=536 TSval=1031 TSecr=1024"
"24","0.030177","167.7.2.3","167.7.4.2","TCP","606","","49153  >  http-alt(8080) [ACK] Seq=7505 Ack=1 Win=131072 Len=536 TSval=1031 TSecr=1024"
"25","0.030233","167.7.2.3","167.7.4.2","TCP","606","","49153  >  http-alt(8080) [ACK] Seq=8041 Ack=1 Win=131072 Len=536 TSval=1031 TSecr=1024"
"27","0.036451","167.7.2.3","167.7.4.2","TCP","606","","49153  >  http-alt(8080) [ACK] Seq=8577 Ack=1 Win=131072 Len=536 TSval=1037 TSecr=1028"
"28","0.036502","167.7.2.3","167.7.4.2","TCP","606","","49153  >  http-alt(8080) [ACK] Seq=9113 Ack=1 Win=131072 Len=536 TSval=1037 TSecr=1028"
"29","0.036561","167.7.2.3","167.7.4.2","TCP","606","","49153  >  http-alt(8080) [ACK] Seq=9649 Ack=1 Win=131072 Len=536 TSval=1037 TSecr=1028"
"30","0.036618","167.7.2.3","167.7.4.2","TCP","606","","49153  >  http-alt(8080) [ACK] Seq=10185 Ack=1 Win=131072 Len=536 TSval=1037 TSecr=1028"
"32","0.036831","167.7.2.3","167.7.4.2","TCP","606","","49153  >  http-alt(8080) [ACK] Seq=10721 Ack=1 Win=131072 Len=536 TSval=1037 TSecr=1028"
"33","0.036881","167.7.2.3","167.7.4.2","TCP","606","","49153  >  http-alt(8080) [ACK] Seq=11257 Ack=1 Win=131072 Len=536 TSval=1037 TSecr=1028"
"34","0.036944","167.7.2.3","167.7.4.2","TCP","606","","49153  >  http-alt(8080) [ACK] Seq=11793 Ack=1 Win=131072 Len=536 TSval=1037 TSecr=1028"
"35","0.036999","167.7.2.3","167.7.4.2","TCP","606","","49153  >  http-alt(8080) [ACK] Seq=12329 Ack=1 Win=131072 Len=536 TSval=1037 TSecr=1028"
"37","0.037519","167.7.2.3","167.7.4.2","TCP","606","","49153  >  http-alt(8080) [ACK] Seq=12865 Ack=1 Win=131072 Len=536 TSval=1038 TSecr=1032"
"38","0.037570","167.7.2.3","167.7.4.2","TCP","606","","49153  >  http-alt(8080) [ACK] Seq=13401 Ack=1 Win=131072 Len=536 TSval=1038 TSecr=1032"
"39","0.037625","167.7.2.3","167.7.4.2","TCP","606","","49153  >  http-alt(8080) [ACK] Seq=13937 Ack=1 Win=131072 Len=536 TSval=1038 TSecr=1032"
"40","0.037684","167.7.2.3","167.7.4.2","TCP","606","","49153  >  http-alt(8080) [ACK] Seq=14473 Ack=1 Win=131072 Len=536 TSval=1038 TSecr=1032"
"42","0.037808","167.7.2.3","167.7.4.2","TCP","606","","49153  >  http-alt(8080) [ACK] Seq=15009 Ack=1 Win=131072 Len=536 TSval=1038 TSecr=1034"
"44","0.037879","167.7.2.3","167.7.4.2","TCP","606","","49153  >  http-alt(8080) [ACK] Seq=15545 Ack=1 Win=131072 Len=536 TSval=1038 TSecr=1034"
"45","0.037936","167.7.2.3","167.7.4.2","TCP","606","","49153  >  http-alt(8080) [ACK] Seq=16081 Ack=1 Win=131072 Len=536 TSval=1038 TSecr=1034"
"46","0.037992","167.7.2.3","167.7.4.2","TCP","606","","49153  >  http-alt(8080) [ACK] Seq=16617 Ack=1 Win=131072 Len=536 TSval=1038 TSecr=1034"
"47","0.038052","167.7.2.3","167.7.4.2","TCP","606","","49153  >  http-alt(8080) [ACK] Seq=17153 Ack=1 Win=131072 Len=536 TSval=1038 TSecr=1035"
"48","0.038108","167.7.2.3","167.7.4.2","TCP","606","","49153  >  http-alt(8080) [ACK] Seq=17689 Ack=1 Win=131072 Len=536 TSval=1038 TSecr=1035"
"49","0.038165","167.7.2.3","167.7.4.2","TCP","606","","49153  >  http-alt(8080) [ACK] Seq=18225 Ack=1 Win=131072 Len=536 TSval=1038 TSecr=1035"
"50","0.038231","167.7.2.3","167.7.4.2","TCP","606","","49153  >  http-alt(8080) [ACK] Seq=18761 Ack=1 Win=131072 Len=536 TSval=1038 TSecr=1035"
"52","0.038868","167.7.2.3","167.7.4.2","TCP","606","","49153  >  http-alt(8080) [ACK] Seq=19297 Ack=1 Win=131072 Len=536 TSval=1039 TSecr=1037"
"53","0.038919","167.7.2.3","167.7.4.2","TCP","606","","49153  >  http-alt(8080) [ACK] Seq=19833 Ack=1 Win=131072 Len=536 TSval=1039 TSecr=1037"
"54","0.038975","167.7.2.3","167.7.4.2","TCP","606","","49153  >  http-alt(8080) [ACK] Seq=20369 Ack=1 Win=131072 Len=536 TSval=1039 TSecr=1037"
"55","0.039037","167.7.2.3","167.7.4.2","TCP","606","","49153  >  http-alt(8080) [ACK] Seq=20905 Ack=1 Win=131072 Len=536 TSval=1039 TSecr=1037"
"57","0.041618","167.7.2.3","167.7.4.2","TCP","606","","49153  >  http-alt(8080) [ACK] Seq=21441 Ack=1 Win=131072 Len=536 TSval=1042 TSecr=1040"
"58","0.041669","167.7.2.3","167.7.4.2","TCP","606","","49153  >  http-alt(8080) [ACK] Seq=21977 Ack=1 Win=131072 Len=536 TSval=1042 TSecr=1040"
"59","0.041731","167.7.2.3","167.7.4.2","TCP","606","","49153  >  http-alt(8080) [ACK] Seq=22513 Ack=1 Win=131072 Len=536 TSval=1042 TSecr=1040"
"60","0.041797","167.7.2.3","167.7.4.2","TCP","606","","49153  >  http-alt(8080) [ACK] Seq=23049 Ack=1 Win=131072 Len=536 TSval=1042 TSecr=1040"
"62","0.043506","167.7.2.3","167.7.4.2","TCP","606","","49153  >  http-alt(8080) [ACK] Seq=23585 Ack=1 Win=131072 Len=536 TSval=1044 TSecr=1042"
"63","0.043557","167.7.2.3","167.7.4.2","TCP","606","","49153  >  http-alt(8080) [ACK] Seq=24121 Ack=1 Win=131072 Len=536 TSval=1044 TSecr=1042"
"64","0.043616","167.7.2.3","167.7.4.2","TCP","606","","49153  >  http-alt(8080) [ACK] Seq=24657 Ack=1 Win=131072 Len=536 TSval=1044 TSecr=1042"
"65","0.043673","167.7.2.3","167.7.4.2","TCP","606","","49153  >  http-alt(8080) [ACK] Seq=25193 Ack=1 Win=131072 Len=536 TSval=1044 TSecr=1042"
"67","0.045394","167.7.2.3","167.7.4.2","TCP","606","","49153  >  http-alt(8080) [ACK] Seq=25729 Ack=1 Win=131072 Len=536 TSval=1046 TSecr=1044"
"68","0.045445","167.7.2.3","167.7.4.2","TCP","606","","49153  >  http-alt(8080) [ACK] Seq=26265 Ack=1 Win=131072 Len=536 TSval=1046 TSecr=1044"
"69","0.045500","167.7.2.3","167.7.4.2","TCP","606","","49153  >  http-alt(8080) [ACK] Seq=26801 Ack=1 Win=131072 Len=536 TSval=1046 TSecr=1044"
"70","0.045563","167.7.2.3","167.7.4.2","TCP","606","","49153  >  http-alt(8080) [ACK] Seq=27337 Ack=1 Win=131072 Len=536 TSval=1046 TSecr=1044"
"72","0.047282","167.7.2.3","167.7.4.2","TCP","606","","49153  >  http-alt(8080) [ACK] Seq=27873 Ack=1 Win=131072 Len=536 TSval=1048 TSecr=1046"
"73","0.047333","167.7.2.3","167.7.4.2","TCP","606","","49153  >  http-alt(8080) [ACK] Seq=28409 Ack=1 Win=131072 Len=536 TSval=1048 TSecr=1046"
"74","0.047389","167.7.2.3","167.7.4.2","TCP","606","","49153  >  http-alt(8080) [ACK] Seq=28945 Ack=1 Win=131072 Len=536 TSval=1048 TSecr=1046"
"75","0.047444","167.7.2.3","167.7.4.2","TCP","606","","49153  >  http-alt(8080) [ACK] Seq=29481 Ack=1 Win=131072 Len=536 TSval=1048 TSecr=1046"
"77","0.049170","167.7.2.3","167.7.4.2","TCP","606","","49153  >  http-alt(8080) [ACK] Seq=30017 Ack=1 Win=131072 Len=536 TSval=1050 TSecr=1048"
"78","0.049221","167.7.2.3","167.7.4.2","TCP","606","","49153  >  http-alt(8080) [ACK] Seq=30553 Ack=1 Win=131072 Len=536 TSval=1050 TSecr=1048"
"79","0.049283","167.7.2.3","167.7.4.2","TCP","606","","49153  >  http-alt(8080) [ACK] Seq=31089 Ack=1 Win=131072 Len=536 TSval=1050 TSecr=1048"
"80","0.049338","167.7.2.3","167.7.4.2","TCP","606","","49153  >  http-alt(8080) [ACK] Seq=31625 Ack=1 Win=131072 Len=536 TSval=1050 TSecr=1048"
"82","0.051058","167.7.2.3","167.7.4.2","TCP","606","","49153  >  http-alt(8080) [ACK] Seq=32161 Ack=1 Win=131072 Len=536 TSval=1052 TSecr=1049"
"83","0.051109","167.7.2.3","167.7.4.2","TCP","606","","49153  >  http-alt(8080) [ACK] Seq=32697 Ack=1 Win=131072 Len=536 TSval=1052 TSecr=1049"
"84","0.051166","167.7.2.3","167.7.4.2","TCP","606","","49153  >  http-alt(8080) [ACK] Seq=33233 Ack=1 Win=131072 Len=536 TSval=1052 TSecr=1049"
"85","0.051224","167.7.2.3","167.7.4.2","TCP","606","","49153  >  http-alt(8080) [ACK] Seq=33769 Ack=1 Win=131072 Len=536 TSval=1052 TSecr=1049"
"87","0.052946","167.7.2.3","167.7.4.2","TCP","606","","49153  >  http-alt(8080) [ACK] Seq=34305 Ack=1 Win=131072 Len=536 TSval=1053 TSecr=1051"
"88","0.052997","167.7.2.3","167.7.4.2","TCP","606","","49153  >  http-alt(8080) [ACK] Seq=34841 Ack=1 Win=131072 Len=536 TSval=1053 TSecr=1051"
"89","0.053062","167.7.2.3","167.7.4.2","TCP","606","","49153  >  http-alt(8080) [ACK] Seq=35377 Ack=1 Win=131072 Len=536 TSval=1053 TSecr=1051"
"90","0.053120","167.7.2.3","167.7.4.2","TCP","606","","49153  >  http-alt(8080) [ACK] Seq=35913 Ack=1 Win=131072 Len=536 TSval=1053 TSecr=1051"
"92","0.054834","167.7.2.3","167.7.4.2","TCP","606","","49153  >  http-alt(8080) [ACK] Seq=36449 Ack=1 Win=131072 Len=536 TSval=1055 TSecr=1053"
"93","0.054885","167.7.2.3","167.7.4.2","TCP","606","","49153  >  http-alt(8080) [ACK] Seq=36985 Ack=1 Win=131072 Len=536 TSval=1055 TSecr=1053"
"94","0.054940","167.7.2.3","167.7.4.2","TCP","606","","49153  >  http-alt(8080) [ACK] Seq=37521 Ack=1 Win=131072 Len=536 TSval=1055 TSecr=1053"
"95","0.054999","167.7.2.3","167.7.4.2","TCP","606","","49153  >  http-alt(8080) [ACK] Seq=38057 Ack=1 Win=131072 Len=536 TSval=1055 TSecr=1053"
"97","0.056722","167.7.2.3","167.7.4.2","TCP","606","","49153  >  http-alt(8080) [ACK] Seq=38593 Ack=1 Win=131072 Len=536 TSval=1057 TSecr=1055"
"98","0.056773","167.7.2.3","167.7.4.2","TCP","606","","49153  >  http-alt(8080) [ACK] Seq=39129 Ack=1 Win=131072 Len=536 TSval=1057 TSecr=1055"
"99","0.056829","167.7.2.3","167.7.4.2","TCP","606","","49153  >  http-alt(8080) [ACK] Seq=39665 Ack=1 Win=131072 Len=536 TSval=1057 TSecr=1055"
"100","0.056886","167.7.2.3","167.7.4.2","TCP","606","","49153  >  http-alt(8080) [ACK] Seq=40201 Ack=1 Win=131072 Len=536 TSval=1057 TSecr=1055"
"102","0.058610","167.7.2.3","167.7.4.2","TCP","606","","49153  >  http-alt(8080) [ACK] Seq=40737 Ack=1 Win=131072 Len=536 TSval=1059 TSecr=1057"
"103","0.058661","167.7.2.3","167.7.4.2","TCP","606","","49153  >  http-alt(8080) [ACK] Seq=41273 Ack=1 Win=131072 Len=536 TSval=1059 TSecr=1057"
"104","0.058717","167.7.2.3","167.7.4.2","TCP","606","","49153  >  http-alt(8080) [ACK] Seq=41809 Ack=1 Win=131072 Len=536 TSval=1059 TSecr=1057"
"105","0.058785","167.7.2.3","167.7.4.2","TCP","606","","49153  >  http-alt(8080) [ACK] Seq=42345 Ack=1 Win=131072 Len=536 TSval=1059 TSecr=1057"
"107","0.060498","167.7.2.3","167.7.4.2","TCP","606","","49153  >  http-alt(8080) [ACK] Seq=42881 Ack=1 Win=131072 Len=536 TSval=1061 TSecr=1059"
"108","0.060549","167.7.2.3","167.7.4.2","TCP","606","","49153  >  http-alt(8080) [ACK] Seq=43417 Ack=1 Win=131072 Len=536 TSval=1061 TSecr=1059"
"109","0.060606","167.7.2.3","167.7.4.2","TCP","606","","49153  >  http-alt(8080) [ACK] Seq=43953 Ack=1 Win=131072 Len=536 TSval=1061 TSecr=1059"
"110","0.060661","167.7.2.3","167.7.4.2","TCP","606","","49153  >  http-alt(8080) [ACK] Seq=44489 Ack=1 Win=131072 Len=536 TSval=1061 TSecr=1059"
"112","0.062386","167.7.2.3","167.7.4.2","TCP","606","","49153  >  http-alt(8080) [ACK] Seq=45025 Ack=1 Win=131072 Len=536 TSval=1063 TSecr=1061"
"113","0.062437","167.7.2.3","167.7.4.2","TCP","606","","49153  >  http-alt(8080) [ACK] Seq=45561 Ack=1 Win=131072 Len=536 TSval=1063 TSecr=1061"
"114","0.062493","167.7.2.3","167.7.4.2","TCP","606","","49153  >  http-alt(8080) [ACK] Seq=46097 Ack=1 Win=131072 Len=536 TSval=1063 TSecr=1061"
"115","0.062554","167.7.2.3","167.7.4.2","TCP","606","","49153  >  http-alt(8080) [ACK] Seq=46633 Ack=1 Win=131072 Len=536 TSval=1063 TSecr=1061"
"117","0.064274","167.7.2.3","167.7.4.2","TCP","606","","49153  >  http-alt(8080) [ACK] Seq=47169 Ack=1 Win=131072 Len=536 TSval=1065 TSecr=1063"
"118","0.064325","167.7.2.3","167.7.4.2","TCP","606","","49153  >  http-alt(8080) [ACK] Seq=47705 Ack=1 Win=131072 Len=536 TSval=1065 TSecr=1063"
"119","0.064382","167.7.2.3","167.7.4.2","TCP","606","","49153  >  http-alt(8080) [ACK] Seq=48241 Ack=1 Win=131072 Len=536 TSval=1065 TSecr=1063"
"120","0.064438","167.7.2.3","167.7.4.2","TCP","606","","49153  >  http-alt(8080) [ACK] Seq=48777 Ack=1 Win=131072 Len=536 TSval=1065 TSecr=1063"
"122","0.066162","167.7.2.3","167.7.4.2","TCP","606","","49153  >  http-alt(8080) [ACK] Seq=49313 Ack=1 Win=131072 Len=536 TSval=1067 TSecr=1065"
"123","0.066213","167.7.2.3","167.7.4.2","TCP","606","","49153  >  http-alt(8080) [ACK] Seq=49849 Ack=1 Win=131072 Len=536 TSval=1067 TSecr=1065"
"125","0.068050","167.7.2.3","167.7.4.2","TCP","606","","49153  >  http-alt(8080) [ACK] Seq=50385 Ack=1 Win=131072 Len=536 TSval=1069 TSecr=1066"
"126","0.068101","167.7.2.3","167.7.4.2","TCP","606","","49153  >  http-alt(8080) [ACK] Seq=50921 Ack=1 Win=131072 Len=536 TSval=1069 TSecr=1066"
"128","0.069938","167.7.2.3","167.7.4.2","TCP","606","","49153  >  http-alt(8080) [ACK] Seq=51457 Ack=1 Win=131072 Len=536 TSval=1070 TSecr=1068"
"129","0.069989","167.7.2.3","167.7.4.2","TCP","606","","49153  >  http-alt(8080) [ACK] Seq=51993 Ack=1 Win=131072 Len=536 TSval=1070 TSecr=1068"
"131","0.071826","167.7.2.3","167.7.4.2","TCP","606","","49153  >  http-alt(8080) [ACK] Seq=52529 Ack=1 Win=131072 Len=536 TSval=1072 TSecr=1070"
"132","0.071877","167.7.2.3","167.7.4.2","TCP","606","","49153  >  http-alt(8080) [ACK] Seq=53065 Ack=1 Win=131072 Len=536 TSval=1072 TSecr=1070"
"134","0.073714","167.7.2.3","167.7.4.2","TCP","606","","49153  >  http-alt(8080) [ACK] Seq=53601 Ack=1 Win=131072 Len=536 TSval=1074 TSecr=1072"
"135","0.073765","167.7.2.3","167.7.4.2","TCP","606","","49153  >  http-alt(8080) [ACK] Seq=54137 Ack=1 Win=131072 Len=536 TSval=1074 TSecr=1072"
"137","0.075602","167.7.2.3","167.7.4.2","TCP","606","","49153  >  http-alt(8080) [ACK] Seq=54673 Ack=1 Win=131072 Len=536 TSval=1076 TSecr=1074"
"138","0.075653","167.7.2.3","167.7.4.2","TCP","606","","49153  >  http-alt(8080) [ACK] Seq=55209 Ack=1 Win=131072 Len=536 TSval=1076 TSecr=1074"
"140","0.077490","167.7.2.3","167.7.4.2","TCP","606","","49153  >  http-alt(8080) [ACK] Seq=55745 Ack=1 Win=131072 Len=536 TSval=1078 TSecr=1076"
"141","0.077541","167.7.2.3","167.7.4.2","TCP","606","","49153  >  http-alt(8080) [ACK] Seq=56281 Ack=1 Win=131072 Len=536 TSval=1078 TSecr=1076"
"143","0.079378","167.7.2.3","167.7.4.2","TCP","606","","49153  >  http-alt(8080) [ACK] Seq=56817 Ack=1 Win=131072 Len=536 TSval=1080 TSecr=1078"
"144","0.079429","167.7.2.3","167.7.4.2","TCP","606","","49153  >  http-alt(8080) [ACK] Seq=57353 Ack=1 Win=131072 Len=536 TSval=1080 TSecr=1078"
"146","0.081266","167.7.2.3","167.7.4.2","TCP","606","","49153  >  http-alt(8080) [ACK] Seq=57889 Ack=1 Win=131072 Len=536 TSval=1082 TSecr=1080"
"147","0.081317","167.7.2.3","167.7.4.2","TCP","606","","49153  >  http-alt(8080) [ACK] Seq=58425 Ack=1 Win=131072 Len=536 TSval=1082 TSecr=1080"
"149","0.083154","167.7.2.3","167.7.4.2","TCP","606","","49153  >  http-alt(8080) [ACK] Seq=58961 Ack=1 Win=131072 Len=536 TSval=1084 TSecr=1082"
"150","0.083205","167.7.2.3","167.7.4.2","TCP","606","","49153  >  http-alt(8080) [ACK] Seq=59497 Ack=1 Win=131072 Len=536 TSval=1084 TSecr=1082"
"151","0.083265","167.7.2.3","167.7.4.2","TCP","606","","49153  >  http-alt(8080) [ACK] Seq=60033 Ack=1 Win=131072 Len=536 TSval=1084 TSecr=1082"
"153","0.085042","167.7.2.3","167.7.4.2","TCP","606","","49153  >  http-alt(8080) [ACK] Seq=60569 Ack=1 Win=131072 Len=536 TSval=1086 TSecr=1083"
"154","0.085093","167.7.2.3","167.7.4.2","TCP","606","","49153  >  http-alt(8080) [ACK] Seq=61105 Ack=1 Win=131072 Len=536 TSval=1086 TSecr=1083"
"156","0.086930","167.7.2.3","167.7.4.2","TCP","606","","49153  >  http-alt(8080) [ACK] Seq=61641 Ack=1 Win=131072 Len=536 TSval=1087 TSecr=1085"
"157","0.086981","167.7.2.3","167.7.4.2","TCP","606","","49153  >  http-alt(8080) [ACK] Seq=62177 Ack=1 Win=131072 Len=536 TSval=1087 TSecr=1085"
"159","0.088818","167.7.2.3","167.7.4.2","TCP","606","","49153  >  http-alt(8080) [ACK] Seq=62713 Ack=1 Win=131072 Len=536 TSval=1089 TSecr=1087"
"160","0.088869","167.7.2.3","167.7.4.2","TCP","606","","49153  >  http-alt(8080) [ACK] Seq=63249 Ack=1 Win=131072 Len=536 TSval=1089 TSecr=1087"
"162","0.090706","167.7.2.3","167.7.4.2","TCP","606","","49153  >  http-alt(8080) [ACK] Seq=63785 Ack=1 Win=131072 Len=536 TSval=1091 TSecr=1089"
"163","0.090757","167.7.2.3","167.7.4.2","TCP","606","","49153  >  http-alt(8080) [ACK] Seq=64321 Ack=1 Win=131072 Len=536 TSval=1091 TSecr=1089"
"165","0.092594","167.7.2.3","167.7.4.2","TCP","606","","49153  >  http-alt(8080) [ACK] Seq=64857 Ack=1 Win=131072 Len=536 TSval=1093 TSecr=1091"
"166","0.092645","167.7.2.3","167.7.4.2","TCP","606","","49153  >  http-alt(8080) [ACK] Seq=65393 Ack=1 Win=131072 Len=536 TSval=1093 TSecr=1091"
"168","0.094482","167.7.2.3","167.7.4.2","TCP","606","","49153  >  http-alt(8080) [ACK] Seq=65929 Ack=1 Win=131072 Len=536 TSval=1095 TSecr=1093"
"169","0.094533","167.7.2.3","167.7.4.2","TCP","606","","49153  >  http-alt(8080) [ACK] Seq=66465 Ack=1 Win=131072 Len=536 TSval=1095 TSecr=1093"
"171","0.096370","167.7.2.3","167.7.4.2","TCP","606","","49153  >  http-alt(8080) [ACK] Seq=67001 Ack=1 Win=131072 Len=536 TSval=1097 TSecr=1095"
"172","0.096421","167.7.2.3","167.7.4.2","TCP","606","","49153  >  http-alt(8080) [ACK] Seq=67537 Ack=1 Win=131072 Len=536 TSval=1097 TSecr=1095"
"174","0.098258","167.7.2.3","167.7.4.2","TCP","606","","49153  >  http-alt(8080) [ACK] Seq=68073 Ack=1 Win=131072 Len=536 TSval=1099 TSecr=1097"
"175","0.098309","167.7.2.3","167.7.4.2","TCP","606","","49153  >  http-alt(8080) [ACK] Seq=68609 Ack=1 Win=131072 Len=536 TSval=1099 TSecr=1097"
"177","0.100146","167.7.2.3","167.7.4.2","TCP","606","","49153  >  http-alt(8080) [ACK] Seq=69145 Ack=1 Win=131072 Len=536 TSval=1101 TSecr=1099"
"178","0.100197","167.7.2.3","167.7.4.2","TCP","606","","49153  >  http-alt(8080) [ACK] Seq=69681 Ack=1 Win=131072 Len=536 TSval=1101 TSecr=1099"
"180","0.102034","167.7.2.3","167.7.4.2","TCP","606","","49153  >  http-alt(8080) [ACK] Seq=70217 Ack=1 Win=131072 Len=536 TSval=1103 TSecr=1100"
"181","0.102085","167.7.2.3","167.7.4.2","TCP","606","","49153  >  http-alt(8080) [ACK] Seq=70753 Ack=1 Win=131072 Len=536 TSval=1103 TSecr=1100"
"182","0.102141","167.7.2.3","167.7.4.2","TCP","606","","49153  >  http-alt(8080) [ACK] Seq=71289 Ack=1 Win=131072 Len=536 TSval=1103 TSecr=1100"
"184","0.103922","167.7.2.3","167.7.4.2","TCP","606","","49153  >  http-alt(8080) [ACK] Seq=71825 Ack=1 Win=131072 Len=536 TSval=1104 TSecr=1102"
"185","0.103973","167.7.2.3","167.7.4.2","TCP","606","","49153  >  http-alt(8080) [ACK] Seq=72361 Ack=1 Win=131072 Len=536 TSval=1104 TSecr=1102"
"187","0.105810","167.7.2.3","167.7.4.2","TCP","606","","49153  >  http-alt(8080) [ACK] Seq=72897 Ack=1 Win=131072 Len=536 TSval=1106 TSecr=1104"
"188","0.105861","167.7.2.3","167.7.4.2","TCP","606","","49153  >  http-alt(8080) [ACK] Seq=73433 Ack=1 Win=131072 Len=536 TSval=1106 TSecr=1104"
"190","0.107698","167.7.2.3","167.7.4.2","TCP","606","","49153  >  http-alt(8080) [ACK] Seq=73969 Ack=1 Win=131072 Len=536 TSval=1108 TSecr=1106"
"191","0.107749","167.7.2.3","167.7.4.2","TCP","606","","49153  >  http-alt(8080) [ACK] Seq=74505 Ack=1 Win=131072 Len=536 TSval=1108 TSecr=1106"
"193","0.109586","167.7.2.3","167.7.4.2","TCP","606","","49153  >  http-alt(8080) [ACK] Seq=75041 Ack=1 Win=131072 Len=536 TSval=1110 TSecr=1108"
"194","0.109637","167.7.2.3","167.7.4.2","TCP","606","","49153  >  http-alt(8080) [ACK] Seq=75577 Ack=1 Win=131072 Len=536 TSval=1110 TSecr=1108"
"196","0.111474","167.7.2.3","167.7.4.2","TCP","606","","49153  >  http-alt(8080) [ACK] Seq=76113 Ack=1 Win=131072 Len=536 TSval=1112 TSecr=1110"
"197","0.111525","167.7.2.3","167.7.4.2","TCP","606","","49153  >  http-alt(8080) [ACK] Seq=76649 Ack=1 Win=131072 Len=536 TSval=1112 TSecr=1110"
"199","0.113362","167.7.2.3","167.7.4.2","TCP","606","","49153  >  http-alt(8080) [ACK] Seq=77185 Ack=1 Win=131072 Len=536 TSval=1114 TSecr=1112"
"200","0.113413","167.7.2.3","167.7.4.2","TCP","606","","49153  >  http-alt(8080) [ACK] Seq=77721 Ack=1 Win=131072 Len=536 TSval=1114 TSecr=1112"
"202","0.115250","167.7.2.3","167.7.4.2","TCP","606","","49153  >  http-alt(8080) [ACK] Seq=78257 Ack=1 Win=131072 Len=536 TSval=1116 TSecr=1114"
"203","0.115301","167.7.2.3","167.7.4.2","TCP","606","","49153  >  http-alt(8080) [ACK] Seq=78793 Ack=1 Win=131072 Len=536 TSval=1116 TSecr=1114"
"205","0.117138","167.7.2.3","167.7.4.2","TCP","606","","49153  >  http-alt(8080) [ACK] Seq=79329 Ack=1 Win=131072 Len=536 TSval=1118 TSecr=1116"
"206","0.117189","167.7.2.3","167.7.4.2","TCP","606","","49153  >  http-alt(8080) [ACK] Seq=79865 Ack=1 Win=131072 Len=536 TSval=1118 TSecr=1116"
"208","0.119026","167.7.2.3","167.7.4.2","TCP","606","","49153  >  http-alt(8080) [ACK] Seq=80401 Ack=1 Win=131072 Len=536 TSval=1120 TSecr=1117"
"209","0.119077","167.7.2.3","167.7.4.2","TCP","606","","49153  >  http-alt(8080) [ACK] Seq=80937 Ack=1 Win=131072 Len=536 TSval=1120 TSecr=1117"
"211","0.120914","167.7.2.3","167.7.4.2","TCP","606","","49153  >  http-alt(8080) [ACK] Seq=81473 Ack=1 Win=131072 Len=536 TSval=1121 TSecr=1119"
"212","0.120965","167.7.2.3","167.7.4.2","TCP","606","","49153  >  http-alt(8080) [ACK] Seq=82009 Ack=1 Win=131072 Len=536 TSval=1121 TSecr=1119"
"213","0.121024","167.7.2.3","167.7.4.2","TCP","606","","49153  >  http-alt(8080) [ACK] Seq=82545 Ack=1 Win=131072 Len=536 TSval=1121 TSecr=1119"
"215","0.122802","167.7.2.3","167.7.4.2","TCP","606","","49153  >  http-alt(8080) [ACK] Seq=83081 Ack=1 Win=131072 Len=536 TSval=1123 TSecr=1121"
"216","0.122853","167.7.2.3","167.7.4.2","TCP","606","","49153  >  http-alt(8080) [ACK] Seq=83617 Ack=1 Win=131072 Len=536 TSval=1123 TSecr=1121"
"218","0.124690","167.7.2.3","167.7.4.2","TCP","606","","49153  >  http-alt(8080) [ACK] Seq=84153 Ack=1 Win=131072 Len=536 TSval=1125 TSecr=1123"
"219","0.124741","167.7.2.3","167.7.4.2","TCP","606","","49153  >  http-alt(8080) [ACK] Seq=84689 Ack=1 Win=131072 Len=536 TSval=1125 TSecr=1123"
"221","0.126578","167.7.2.3","167.7.4.2","TCP","606","","49153  >  http-alt(8080) [ACK] Seq=85225 Ack=1 Win=131072 Len=536 TSval=1127 TSecr=1125"
"222","0.126629","167.7.2.3","167.7.4.2","TCP","606","","49153  >  http-alt(8080) [ACK] Seq=85761 Ack=1 Win=131072 Len=536 TSval=1127 TSecr=1125"
"224","0.128466","167.7.2.3","167.7.4.2","TCP","606","","49153  >  http-alt(8080) [ACK] Seq=86297 Ack=1 Win=131072 Len=536 TSval=1129 TSecr=1127"
"225","0.128517","167.7.2.3","167.7.4.2","TCP","606","","49153  >  http-alt(8080) [ACK] Seq=86833 Ack=1 Win=131072 Len=536 TSval=1129 TSecr=1127"
"227","0.130354","167.7.2.3","167.7.4.2","TCP","606","","49153  >  http-alt(8080) [ACK] Seq=87369 Ack=1 Win=131072 Len=536 TSval=1131 TSecr=1129"
"228","0.130405","167.7.2.3","167.7.4.2","TCP","606","","49153  >  http-alt(8080) [ACK] Seq=87905 Ack=1 Win=131072 Len=536 TSval=1131 TSecr=1129"
"230","0.132242","167.7.2.3","167.7.4.2","TCP","606","","49153  >  http-alt(8080) [ACK] Seq=88441 Ack=1 Win=131072 Len=536 TSval=1133 TSecr=1131"
"231","0.132293","167.7.2.3","167.7.4.2","TCP","606","","49153  >  http-alt(8080) [ACK] Seq=88977 Ack=1 Win=131072 Len=536 TSval=1133 TSecr=1131"
"233","0.134130","167.7.2.3","167.7.4.2","TCP","606","","49153  >  http-alt(8080) [ACK] Seq=89513 Ack=1 Win=131072 Len=536 TSval=1135 TSecr=1133"
"234","0.134181","167.7.2.3","167.7.4.2","TCP","606","","49153  >  http-alt(8080) [ACK] Seq=90049 Ack=1 Win=131072 Len=536 TSval=1135 TSecr=1133"
"236","0.136018","167.7.2.3","167.7.4.2","TCP","606","","49153  >  http-alt(8080) [ACK] Seq=90585 Ack=1 Win=131072 Len=536 TSval=1137 TSecr=1134"
"237","0.136069","167.7.2.3","167.7.4.2","TCP","606","","49153  >  http-alt(8080) [ACK] Seq=91121 Ack=1 Win=131072 Len=536 TSval=1137 TSecr=1134"
"239","0.137906","167.7.2.3","167.7.4.2","TCP","606","","49153  >  http-alt(8080) [ACK] Seq=91657 Ack=1 Win=131072 Len=536 TSval=1138 TSecr=1136"
"240","0.137957","167.7.2.3","167.7.4.2","TCP","606","","49153  >  http-alt(8080) [ACK] Seq=92193 Ack=1 Win=131072 Len=536 TSval=1138 TSecr=1136"
"242","0.139794","167.7.2.3","167.7.4.2","TCP","606","","49153  >  http-alt(8080) [ACK] Seq=92729 Ack=1 Win=131072 Len=536 TSval=1140 TSecr=1138"
"243","0.139845","167.7.2.3","167.7.4.2","TCP","606","","49153  >  http-alt(8080) [ACK] Seq=93265 Ack=1 Win=131072 Len=536 TSval=1140 TSecr=1138"
"244","0.139903","167.7.2.3","167.7.4.2","TCP","606","","49153  >  http-alt(8080) [ACK] Seq=93801 Ack=1 Win=131072 Len=536 TSval=1140 TSecr=1138"
"246","0.141682","167.7.2.3","167.7.4.2","TCP","606","","49153  >  http-alt(8080) [ACK] Seq=94337 Ack=1 Win=131072 Len=536 TSval=1142 TSecr=1140"
"247","0.141733","167.7.2.3","167.7.4.2","TCP","606","","49153  >  http-alt(8080) [ACK] Seq=94873 Ack=1 Win=131072 Len=536 TSval=1142 TSecr=1140"
"249","0.143570","167.7.2.3","167.7.4.2","TCP","606","","49153  >  http-alt(8080) [ACK] Seq=95409 Ack=1 Win=131072 Len=536 TSval=1144 TSecr=1142"
"250","0.143621","167.7.2.3","167.7.4.2","TCP","606","","49153  >  http-alt(8080) [ACK] Seq=95945 Ack=1 Win=131072 Len=536 TSval=1144 TSecr=1142"
"252","0.145458","167.7.2.3","167.7.4.2","TCP","606","","49153  >  http-alt(8080) [ACK] Seq=96481 Ack=1 Win=131072 Len=536 TSval=1146 TSecr=1144"
"253","0.145509","167.7.2.3","167.7.4.2","TCP","606","","49153  >  http-alt(8080) [ACK] Seq=97017 Ack=1 Win=131072 Len=536 TSval=1146 TSecr=1144"
"255","0.147346","167.7.2.3","167.7.4.2","TCP","606","","49153  >  http-alt(8080) [ACK] Seq=97553 Ack=1 Win=131072 Len=536 TSval=1148 TSecr=1146"
"256","0.147397","167.7.2.3","167.7.4.2","TCP","606","","49153  >  http-alt(8080) [ACK] Seq=98089 Ack=1 Win=131072 Len=536 TSval=1148 TSecr=1146"
"258","0.149234","167.7.2.3","167.7.4.2","TCP","606","","49153  >  http-alt(8080) [ACK] Seq=98625 Ack=1 Win=131072 Len=536 TSval=1150 TSecr=1148"
"259","0.149285","167.7.2.3","167.7.4.2","TCP","606","","49153  >  http-alt(8080) [ACK] Seq=99161 Ack=1 Win=131072 Len=536 TSval=1150 TSecr=1148"
"261","0.151122","167.7.2.3","167.7.4.2","TCP","606","","49153  >  http-alt(8080) [ACK] Seq=99697 Ack=1 Win=131072 Len=536 TSval=1152 TSecr=1150"
"262","0.151173","167.7.2.3","167.7.4.2","TCP","606","","49153  >  http-alt(8080) [ACK] Seq=100233 Ack=1 Win=131072 Len=536 TSval=1152 TSecr=1150"
"264","0.153010","167.7.2.3","167.7.4.2","TCP","606","","49153  >  http-alt(8080) [ACK] Seq=100769 Ack=1 Win=131072 Len=536 TSval=1154 TSecr=1151"
"265","0.153061","167.7.2.3","167.7.4.2","TCP","606","","49153  >  http-alt(8080) [ACK] Seq=101305 Ack=1 Win=131072 Len=536 TSval=1154 TSecr=1151"
"267","0.154898","167.7.2.3","167.7.4.2","TCP","606","","49153  >  http-alt(8080) [ACK] Seq=101841 Ack=1 Win=131072 Len=536 TSval=1155 TSecr=1153"
"268","0.154949","167.7.2.3","167.7.4.2","TCP","606","","49153  >  http-alt(8080) [ACK] Seq=102377 Ack=1 Win=131072 Len=536 TSval=1155 TSecr=1153"
"270","0.156786","167.7.2.3","167.7.4.2","TCP","606","","49153  >  http-alt(8080) [ACK] Seq=102913 Ack=1 Win=131072 Len=536 TSval=1157 TSecr=1155"
"271","0.156837","167.7.2.3","167.7.4.2","TCP","606","","49153  >  http-alt(8080) [ACK] Seq=103449 Ack=1 Win=131072 Len=536 TSval=1157 TSecr=1155"
"273","0.158674","167.7.2.3","167.7.4.2","TCP","606","","49153  >  http-alt(8080) [ACK] Seq=103985 Ack=1 Win=131072 Len=536 TSval=1159 TSecr=1157"
"274","0.158725","167.7.2.3","167.7.4.2","TCP","606","","49153  >  http-alt(8080) [ACK] Seq=104521 Ack=1 Win=131072 Len=536 TSval=1159 TSecr=1157"
"275","0.158782","167.7.2.3","167.7.4.2","TCP","606","","49153  >  http-alt(8080) [ACK] Seq=105057 Ack=1 Win=131072 Len=536 TSval=1159 TSecr=1157"
"277","0.160562","167.7.2.3","167.7.4.2","TCP","606","","49153  >  http-alt(8080) [ACK] Seq=105593 Ack=1 Win=131072 Len=536 TSval=1161 TSecr=1159"
"278","0.160613","167.7.2.3","167.7.4.2","TCP","606","","49153  >  http-alt(8080) [ACK] Seq=106129 Ack=1 Win=131072 Len=536 TSval=1161 TSecr=1159"
"280","0.162450","167.7.2.3","167.7.4.2","TCP","606","","49153  >  http-alt(8080) [ACK] Seq=106665 Ack=1 Win=131072 Len=536 TSval=1163 TSecr=1161"
"281","0.162501","167.7.2.3","167.7.4.2","TCP","606","","49153  >  http-alt(8080) [ACK] Seq=107201 Ack=1 Win=131072 Len=536 TSval=1163 TSecr=1161"
"283","0.164338","167.7.2.3","167.7.4.2","TCP","606","","49153  >  http-alt(8080) [ACK] Seq=107737 Ack=1 Win=131072 Len=536 TSval=1165 TSecr=1163"
"284","0.164389","167.7.2.3","167.7.4.2","TCP","606","","49153  >  http-alt(8080) [ACK] Seq=108273 Ack=1 Win=131072 Len=536 TSval=1165 TSecr=1163"
"286","0.166226","167.7.2.3","167.7.4.2","TCP","606","","49153  >  http-alt(8080) [ACK] Seq=108809 Ack=1 Win=131072 Len=536 TSval=1167 TSecr=1165"
"287","0.166277","167.7.2.3","167.7.4.2","TCP","606","","49153  >  http-alt(8080) [ACK] Seq=109345 Ack=1 Win=131072 Len=536 TSval=1167 TSecr=1165"
"289","0.168114","167.7.2.3","167.7.4.2","TCP","606","","49153  >  http-alt(8080) [ACK] Seq=109881 Ack=1 Win=131072 Len=536 TSval=1169 TSecr=1167"
"290","0.168165","167.7.2.3","167.7.4.2","TCP","606","","49153  >  http-alt(8080) [ACK] Seq=110417 Ack=1 Win=131072 Len=536 TSval=1169 TSecr=1167"
"292","0.170002","167.7.2.3","167.7.4.2","TCP","606","","49153  >  http-alt(8080) [ACK] Seq=110953 Ack=1 Win=131072 Len=536 TSval=1171 TSecr=1168"
"293","0.170053","167.7.2.3","167.7.4.2","TCP","606","","49153  >  http-alt(8080) [ACK] Seq=111489 Ack=1 Win=131072 Len=536 TSval=1171 TSecr=1168"
"295","0.171890","167.7.2.3","167.7.4.2","TCP","606","","49153  >  http-alt(8080) [ACK] Seq=112025 Ack=1 Win=131072 Len=536 TSval=1172 TSecr=1170"
"296","0.171941","167.7.2.3","167.7.4.2","TCP","606","","49153  >  http-alt(8080) [ACK] Seq=112561 Ack=1 Win=131072 Len=536 TSval=1172 TSecr=1170"
"298","0.173778","167.7.2.3","167.7.4.2","TCP","606","","49153  >  http-alt(8080) [ACK] Seq=113097 Ack=1 Win=131072 Len=536 TSval=1174 TSecr=1172"
"299","0.173829","167.7.2.3","167.7.4.2","TCP","606","","49153  >  http-alt(8080) [ACK] Seq=113633 Ack=1 Win=131072 Len=536 TSval=1174 TSecr=1172"
"301","0.175666","167.7.2.3","167.7.4.2","TCP","606","","49153  >  http-alt(8080) [ACK] Seq=114169 Ack=1 Win=131072 Len=536 TSval=1176 TSecr=1174"
"302","0.175717","167.7.2.3","167.7.4.2","TCP","606","","49153  >  http-alt(8080) [ACK] Seq=114705 Ack=1 Win=131072 Len=536 TSval=1176 TSecr=1174"
"304","0.177554","167.7.2.3","167.7.4.2","TCP","606","","49153  >  http-alt(8080) [ACK] Seq=115241 Ack=1 Win=131072 Len=536 TSval=1178 TSecr=1176"
"305","0.177605","167.7.2.3","167.7.4.2","TCP","606","","49153  >  http-alt(8080) [ACK] Seq=115777 Ack=1 Win=131072 Len=536 TSval=1178 TSecr=1176"
"306","0.177661","167.7.2.3","167.7.4.2","TCP","606","","49153  >  http-alt(8080) [ACK] Seq=116313 Ack=1 Win=131072 Len=536 TSval=1178 TSecr=1176"
"308","0.179442","167.7.2.3","167.7.4.2","TCP","606","","49153  >  http-alt(8080) [ACK] Seq=116849 Ack=1 Win=131072 Len=536 TSval=1180 TSecr=1178"
"309","0.179493","167.7.2.3","167.7.4.2","TCP","606","","49153  >  http-alt(8080) [ACK] Seq=117385 Ack=1 Win=131072 Len=536 TSval=1180 TSecr=1178"
"311","0.181330","167.7.2.3","167.7.4.2","TCP","606","","49153  >  http-alt(8080) [ACK] Seq=117921 Ack=1 Win=131072 Len=536 TSval=1182 TSecr=1180"
"312","0.181381","167.7.2.3","167.7.4.2","TCP","606","","49153  >  http-alt(8080) [ACK] Seq=118457 Ack=1 Win=131072 Len=536 TSval=1182 TSecr=1180"
"314","0.183218","167.7.2.3","167.7.4.2","TCP","606","","49153  >  http-alt(8080) [ACK] Seq=118993 Ack=1 Win=131072 Len=536 TSval=1184 TSecr=1182"
"315","0.183269","167.7.2.3","167.7.4.2","TCP","606","","49153  >  http-alt(8080) [ACK] Seq=119529 Ack=1 Win=131072 Len=536 TSval=1184 TSecr=1182"
"317","0.185106","167.7.2.3","167.7.4.2","TCP","606","","49153  >  http-alt(8080) [ACK] Seq=120065 Ack=1 Win=131072 Len=536 TSval=1186 TSecr=1183"
"318","0.185157","167.7.2.3","167.7.4.2","TCP","606","","49153  >  http-alt(8080) [ACK] Seq=120601 Ack=1 Win=131072 Len=536 TSval=1186 TSecr=1183"
"320","0.186994","167.7.2.3","167.7.4.2","TCP","606","","49153  >  http-alt(8080) [ACK] Seq=121137 Ack=1 Win=131072 Len=536 TSval=1187 TSecr=1185"
"321","0.187045","167.7.2.3","167.7.4.2","TCP","606","","49153  >  http-alt(8080) [ACK] Seq=121673 Ack=1 Win=131072 Len=536 TSval=1187 TSecr=1185"
"323","0.188882","167.7.2.3","167.7.4.2","TCP","606","","49153  >  http-alt(8080) [ACK] Seq=122209 Ack=1 Win=131072 Len=536 TSval=1189 TSecr=1187"
"324","0.188933","167.7.2.3","167.7.4.2","TCP","606","","49153  >  http-alt(8080) [ACK] Seq=122745 Ack=1 Win=131072 Len=536 TSval=1189 TSecr=1187"
"326","0.190770","167.7.2.3","167.7.4.2","TCP","606","","49153  >  http-alt(8080) [ACK] Seq=123281 Ack=1 Win=131072 Len=536 TSval=1191 TSecr=1189"
"327","0.190821","167.7.2.3","167.7.4.2","TCP","606","","49153  >  http-alt(8080) [ACK] Seq=123817 Ack=1 Win=131072 Len=536 TSval=1191 TSecr=1189"
"329","0.192658","167.7.2.3","167.7.4.2","TCP","606","","49153  >  http-alt(8080) [ACK] Seq=124353 Ack=1 Win=131072 Len=536 TSval=1193 TSecr=1191"
"330","0.192709","167.7.2.3","167.7.4.2","TCP","606","","49153  >  http-alt(8080) [ACK] Seq=124889 Ack=1 Win=131072 Len=536 TSval=1193 TSecr=1191"
"332","0.194546","167.7.2.3","167.7.4.2","TCP","606","","49153  >  http-alt(8080) [ACK] Seq=125425 Ack=1 Win=131072 Len=536 TSval=1195 TSecr=1193"
"333","0.194597","167.7.2.3","167.7.4.2","TCP","606","","49153  >  http-alt(8080) [ACK] Seq=125961 Ack=1 Win=131072 Len=536 TSval=1195 TSecr=1193"
"335","0.196434","167.7.2.3","167.7.4.2","TCP","606","","49153  >  http-alt(8080) [ACK] Seq=126497 Ack=1 Win=131072 Len=536 TSval=1197 TSecr=1195"
"336","0.196485","167.7.2.3","167.7.4.2","TCP","606","","49153  >  http-alt(8080) [ACK] Seq=127033 Ack=1 Win=131072 Len=536 TSval=1197 TSecr=1195"
"337","0.196543","167.7.2.3","167.7.4.2","TCP","606","","49153  >  http-alt(8080) [ACK] Seq=127569 Ack=1 Win=131072 Len=536 TSval=1197 TSecr=1195"
"339","0.198322","167.7.2.3","167.7.4.2","TCP","606","","49153  >  http-alt(8080) [ACK] Seq=128105 Ack=1 Win=131072 Len=536 TSval=1199 TSecr=1197"
"340","0.198373","167.7.2.3","167.7.4.2","TCP","606","","49153  >  http-alt(8080) [ACK] Seq=128641 Ack=1 Win=131072 Len=536 TSval=1199 TSecr=1197"
"342","0.200210","167.7.2.3","167.7.4.2","TCP","606","","49153  >  http-alt(8080) [ACK] Seq=129177 Ack=1 Win=131072 Len=536 TSval=1201 TSecr=1199"
"343","0.200261","167.7.2.3","167.7.4.2","TCP","606","","49153  >  http-alt(8080) [ACK] Seq=129713 Ack=1 Win=131072 Len=536 TSval=1201 TSecr=1199"
"345","0.202098","167.7.2.3","167.7.4.2","TCP","606","","49153  >  http-alt(8080) [ACK] Seq=130249 Ack=1 Win=131072 Len=536 TSval=1203 TSecr=1200"
"346","0.202149","167.7.2.3","167.7.4.2","TCP","358","","49153  >  http-alt(8080) [ACK] Seq=130785 Ack=1 Win=131072 Len=288 TSval=1203 TSecr=1200"
